{
  "report_id": "SYNTHETIC-report-1",
  "contract_version": "v1.0.0-draft",
  "manifest_sha256": "b448565f3b5e8d45e87c721f57ba2f96e9aa5774cc8d4ebcbbc141b25811c8a1",
  "items": [
    {
      "manifest_pointer": "/inventory_id",
      "status": "supported",
      "reason": "pinned-format-compatible",
      "reference": {
        "kind": "work-order",
        "id": "IOT-WO-04"
      }
    },
    {
      "manifest_pointer": "/contract_version",
      "status": "needs-work",
      "reason": "implementation-required",
      "reference": {
        "kind": "work-order",
        "id": "IOT-WO-04"
      }
    },
    {
      "manifest_pointer": "/tb/edition",
      "status": "blocked",
      "reason": "capacity-unproven",
      "reference": {
        "kind": "work-order",
        "id": "IOT-WO-04"
      }
    },
    {
      "manifest_pointer": "/tb/version",
      "status": "supported",
      "reason": "pinned-format-compatible",
      "reference": {
        "kind": "work-order",
        "id": "IOT-WO-04"
      }
    },
    {
      "manifest_pointer": "/tb/build",
      "status": "needs-work",
      "reason": "implementation-required",
      "reference": {
        "kind": "work-order",
        "id": "IOT-WO-04"
      }
    },
    {
      "manifest_pointer": "/fork/forked",
      "status": "blocked",
      "reason": "capacity-unproven",
      "reference": {
        "kind": "work-order",
        "id": "IOT-WO-04"
      }
    },
    {
      "manifest_pointer": "/fork/evidence_sha256",
      "status": "supported",
      "reason": "pinned-format-compatible",
      "reference": {
        "kind": "work-order",
        "id": "IOT-WO-04"
      }
    },
    {
      "manifest_pointer": "/customizations/rule_nodes",
      "status": "needs-work",
      "reason": "implementation-required",
      "reference": {
        "kind": "work-order",
        "id": "IOT-WO-04"
      }
    },
    {
      "manifest_pointer": "/customizations/scripts",
      "status": "blocked",
      "reason": "capacity-unproven",
      "reference": {
        "kind": "work-order",
        "id": "IOT-WO-04"
      }
    },
    {
      "manifest_pointer": "/customizations/widgets",
      "status": "supported",
      "reason": "pinned-format-compatible",
      "reference": {
        "kind": "work-order",
        "id": "IOT-WO-04"
      }
    },
    {
      "manifest_pointer": "/telemetry_backend",
      "status": "needs-work",
      "reason": "implementation-required",
      "reference": {
        "kind": "work-order",
        "id": "IOT-WO-04"
      }
    },
    {
      "manifest_pointer": "/tenants/0/tenant_ref",
      "status": "blocked",
      "reason": "capacity-unproven",
      "reference": {
        "kind": "work-order",
        "id": "IOT-WO-04"
      }
    },
    {
      "manifest_pointer": "/tenants/0/counts/tenants",
      "status": "supported",
      "reason": "pinned-format-compatible",
      "reference": {
        "kind": "work-order",
        "id": "IOT-WO-04"
      }
    },
    {
      "manifest_pointer": "/tenants/0/counts/customers",
      "status": "needs-work",
      "reason": "implementation-required",
      "reference": {
        "kind": "work-order",
        "id": "IOT-WO-04"
      }
    },
    {
      "manifest_pointer": "/tenants/0/counts/users",
      "status": "blocked",
      "reason": "capacity-unproven",
      "reference": {
        "kind": "work-order",
        "id": "IOT-WO-04"
      }
    },
    {
      "manifest_pointer": "/tenants/0/counts/groups",
      "status": "supported",
      "reason": "pinned-format-compatible",
      "reference": {
        "kind": "work-order",
        "id": "IOT-WO-04"
      }
    },
    {
      "manifest_pointer": "/tenants/0/counts/roles",
      "status": "needs-work",
      "reason": "implementation-required",
      "reference": {
        "kind": "work-order",
        "id": "IOT-WO-04"
      }
    },
    {
      "manifest_pointer": "/tenants/0/counts/role-assignments",
      "status": "blocked",
      "reason": "capacity-unproven",
      "reference": {
        "kind": "work-order",
        "id": "IOT-WO-04"
      }
    },
    {
      "manifest_pointer": "/tenants/0/counts/devices",
      "status": "supported",
      "reason": "pinned-format-compatible",
      "reference": {
        "kind": "work-order",
        "id": "IOT-WO-04"
      }
    },
    {
      "manifest_pointer": "/tenants/0/counts/assets",
      "status": "needs-work",
      "reason": "implementation-required",
      "reference": {
        "kind": "work-order",
        "id": "IOT-WO-04"
      }
    },
    {
      "manifest_pointer": "/tenants/0/counts/relations",
      "status": "blocked",
      "reason": "capacity-unproven",
      "reference": {
        "kind": "work-order",
        "id": "IOT-WO-04"
      }
    },
    {
      "manifest_pointer": "/tenants/0/counts/locations",
      "status": "supported",
      "reason": "pinned-format-compatible",
      "reference": {
        "kind": "work-order",
        "id": "IOT-WO-04"
      }
    },
    {
      "manifest_pointer": "/tenants/0/counts/customer-assignments",
      "status": "needs-work",
      "reason": "implementation-required",
      "reference": {
        "kind": "work-order",
        "id": "IOT-WO-04"
      }
    },
    {
      "manifest_pointer": "/tenants/0/counts/device-profiles",
      "status": "blocked",
      "reason": "capacity-unproven",
      "reference": {
        "kind": "work-order",
        "id": "IOT-WO-04"
      }
    },
    {
      "manifest_pointer": "/tenants/0/counts/asset-profiles",
      "status": "supported",
      "reason": "pinned-format-compatible",
      "reference": {
        "kind": "work-order",
        "id": "IOT-WO-04"
      }
    },
    {
      "manifest_pointer": "/tenants/0/counts/attributes-server",
      "status": "needs-work",
      "reason": "implementation-required",
      "reference": {
        "kind": "work-order",
        "id": "IOT-WO-04"
      }
    },
    {
      "manifest_pointer": "/tenants/0/counts/attributes-shared",
      "status": "blocked",
      "reason": "capacity-unproven",
      "reference": {
        "kind": "work-order",
        "id": "IOT-WO-04"
      }
    },
    {
      "manifest_pointer": "/tenants/0/counts/attributes-client",
      "status": "supported",
      "reason": "pinned-format-compatible",
      "reference": {
        "kind": "work-order",
        "id": "IOT-WO-04"
      }
    },
    {
      "manifest_pointer": "/tenants/0/counts/desired-state",
      "status": "needs-work",
      "reason": "implementation-required",
      "reference": {
        "kind": "work-order",
        "id": "IOT-WO-04"
      }
    },
    {
      "manifest_pointer": "/tenants/0/counts/reported-state",
      "status": "blocked",
      "reason": "capacity-unproven",
      "reference": {
        "kind": "work-order",
        "id": "IOT-WO-04"
      }
    },
    {
      "manifest_pointer": "/tenants/0/counts/telemetry-historical",
      "status": "supported",
      "reason": "pinned-format-compatible",
      "reference": {
        "kind": "work-order",
        "id": "IOT-WO-04"
      }
    },
    {
      "manifest_pointer": "/tenants/0/counts/telemetry-latest",
      "status": "needs-work",
      "reason": "implementation-required",
      "reference": {
        "kind": "work-order",
        "id": "IOT-WO-04"
      }
    },
    {
      "manifest_pointer": "/tenants/0/counts/rule-chains",
      "status": "blocked",
      "reason": "capacity-unproven",
      "reference": {
        "kind": "work-order",
        "id": "IOT-WO-04"
      }
    },
    {
      "manifest_pointer": "/tenants/0/counts/rule-nodes",
      "status": "supported",
      "reason": "pinned-format-compatible",
      "reference": {
        "kind": "work-order",
        "id": "IOT-WO-04"
      }
    },
    {
      "manifest_pointer": "/tenants/0/counts/scripts",
      "status": "needs-work",
      "reason": "implementation-required",
      "reference": {
        "kind": "work-order",
        "id": "IOT-WO-04"
      }
    },
    {
      "manifest_pointer": "/tenants/0/counts/calculated-fields",
      "status": "blocked",
      "reason": "capacity-unproven",
      "reference": {
        "kind": "work-order",
        "id": "IOT-WO-04"
      }
    },
    {
      "manifest_pointer": "/tenants/0/counts/alarm-rules",
      "status": "supported",
      "reason": "pinned-format-compatible",
      "reference": {
        "kind": "work-order",
        "id": "IOT-WO-04"
      }
    },
    {
      "manifest_pointer": "/tenants/0/counts/alarms-historical",
      "status": "needs-work",
      "reason": "implementation-required",
      "reference": {
        "kind": "work-order",
        "id": "IOT-WO-04"
      }
    },
    {
      "manifest_pointer": "/tenants/0/counts/alarm-history",
      "status": "blocked",
      "reason": "capacity-unproven",
      "reference": {
        "kind": "work-order",
        "id": "IOT-WO-04"
      }
    },
    {
      "manifest_pointer": "/tenants/0/counts/alarms-active",
      "status": "supported",
      "reason": "pinned-format-compatible",
      "reference": {
        "kind": "work-order",
        "id": "IOT-WO-04"
      }
    },
    {
      "manifest_pointer": "/tenants/0/counts/dashboards",
      "status": "needs-work",
      "reason": "implementation-required",
      "reference": {
        "kind": "work-order",
        "id": "IOT-WO-04"
      }
    },
    {
      "manifest_pointer": "/tenants/0/counts/widgets",
      "status": "blocked",
      "reason": "capacity-unproven",
      "reference": {
        "kind": "work-order",
        "id": "IOT-WO-04"
      }
    },
    {
      "manifest_pointer": "/tenants/0/counts/maps",
      "status": "supported",
      "reason": "pinned-format-compatible",
      "reference": {
        "kind": "work-order",
        "id": "IOT-WO-04"
      }
    },
    {
      "manifest_pointer": "/tenants/0/counts/entity-views",
      "status": "needs-work",
      "reason": "implementation-required",
      "reference": {